{
    "$schema":  "https://a2d.local/schemas/application-rules-v1.schema.json",
    "schemaVersion":  "1.0",
    "application":  {
                        "id":  "sample-app-262",
                        "name":  "Aplicação de Exemplo 262",
                        "description":  "Aplicação sintética 262 para testes locais de migração",
                        "owners":  [
                                       "sre-team-10"
                                   ],
                        "labels":  {
                                       "businessUnit":  "unit-2",
                                       "environment":  "development"
                                   }
                    },
    "defaults":  {
                     "enabled":  true,
                     "eventType":  "ERROR_EVENT",
                     "alertGroup":  "sample-app-262",
                     "profile":  {
                                     "name":  "NOC - Equipe 10",
                                     "severity":  "ERROR",
                                     "delayMinutes":  0,
                                     "tagFilters":  [
                                                        "team:team-10"
                                                    ]
                                 },
                     "schedule":  {
                                      "mode":  "ACTIVE_WINDOW",
                                      "timezone":  "America/Sao_Paulo",
                                      "windows":  [
                                                      {
                                                          "days":  [
                                                                       "MON",
                                                                       "TUE",
                                                                       "WED",
                                                                       "THU",
                                                                       "FRI"
                                                                   ],
                                                          "start":  "09:00",
                                                          "end":  "18:00"
                                                      }
                                                  ]
                                  }
                 },
    "rules":  [
                  {
                      "id":  "APPD-SAMPLE-262-ERROR",
                      "name":  "Aplicação 262 - quantidade de erros",
                      "groupId":  "sample-app-262-errors",
                      "description":  "Quantidade de falhas acima do limite operacional",
                      "targets":  [
                                      {
                                          "selectorType":  "NAME",
                                          "value":  "sample-app-262-api"
                                      },
                                      {
                                          "selectorType":  "NAME",
                                          "value":  "sample-app-262-worker"
                                      }
                                  ],
                      "signal":  {
                                     "kind":  "METRIC",
                                     "metricKey":  "dt.service.request.failure_count",
                                     "aggregation":  "SUM"
                                 },
                      "detector":  {
                                       "model":  "STATIC",
                                       "condition":  "ABOVE",
                                       "threshold":  7,
                                       "violatingSamples":  3,
                                       "slidingWindow":  5,
                                       "dealertingSamples":  3,
                                       "alertOnMissingData":  false
                                   },
                      "event":  {
                                    "name":  "Aplicação 262 com erros acima do limite",
                                    "description":  "Erros detectados nos serviços da aplicação 262."
                                }
                  },
                  {
                      "id":  "APPD-SAMPLE-262-LATENCY",
                      "name":  "Aplicação 262 - anomalia de latência",
                      "targets":  [
                                      {
                                          "selectorType":  "ENTITY_ID",
                                          "value":  "SERVICE-0000000000000106"
                                      }
                                  ],
                      "signal":  {
                                     "kind":  "METRIC",
                                     "metricKey":  "dt.service.request.response_time",
                                     "aggregation":  "AVG"
                                 },
                      "detector":  {
                                       "model":  "AUTO_ADAPTIVE",
                                       "condition":  "ABOVE",
                                       "numberOfSignalFluctuations":  1,
                                       "violatingSamples":  3,
                                       "slidingWindow":  5,
                                       "dealertingSamples":  5,
                                       "alertOnMissingData":  false
                                   },
                      "event":  {
                                    "name":  "Latência anormal na aplicação 262",
                                    "type":  "PERFORMANCE_EVENT",
                                    "alertGroup":  "sample-app-262"
                                },
                      "schedule":  {
                                       "mode":  "ALWAYS"
                                   }
                  }
              ]
}